{
  "schema_version": "1",
  "generated_at": "2026-05-20T22:21:21Z",
  "skill_count": 79,
  "skills": [
    {
      "name": "autodev",
      "description": "Manage bounded autonomous dev loops.",
      "hexagonal_role": "supporting",
      "user_invocable": true,
      "consumes": [
        "evolve",
        "rpi"
      ],
      "produces": [],
      "practices": [
        "cmm-process-maturity",
        "ai-assisted-dev",
        "dora-metrics"
      ],
      "context_rel": [],
      "references_count": 0,
      "codex_override_present": true
    },
    {
      "name": "beads",
      "description": "Track issues with bd/br, triage with bv, and convert plans to beads.",
      "hexagonal_role": "driven-adapter",
      "user_invocable": false,
      "consumes": [
        "bd-issue"
      ],
      "produces": [
        "bd-issue"
      ],
      "practices": [
        "agile-manifesto",
        "pragmatic-programmer"
      ],
      "context_rel": [
        {
          "kind": "supplier-to",
          "with": "crank"
        },
        {
          "kind": "supplier-to",
          "with": "ratchet"
        }
      ],
      "references_count": 19,
      "codex_override_present": true
    },
    {
      "name": "bootstrap",
      "description": "Initialize AgentOps project files.",
      "hexagonal_role": "driving-adapter",
      "user_invocable": true,
      "consumes": [
        "goals",
        "product",
        "readme",
        "shared"
      ],
      "produces": [],
      "practices": [
        "containers",
        "hermetic-builds",
        "code-complete"
      ],
      "context_rel": [],
      "references_count": 1,
      "codex_override_present": true
    },
    {
      "name": "brainstorm",
      "description": "Separate goals from implementation.",
      "hexagonal_role": "domain",
      "user_invocable": false,
      "consumes": [
        "standards"
      ],
      "produces": [
        "result.json",
        "verdict.json"
      ],
      "practices": [
        "lean-startup",
        "mythical-man-month"
      ],
      "context_rel": [
        {
          "kind": "shared-kernel",
          "with": "standards"
        }
      ],
      "references_count": 1,
      "codex_override_present": true
    },
    {
      "name": "bug-hunt",
      "description": "Investigate bugs and root causes.",
      "hexagonal_role": "domain",
      "user_invocable": false,
      "consumes": [
        "beads",
        "standards"
      ],
      "produces": [],
      "practices": [
        "refactoring",
        "property-based-testing",
        "code-complete"
      ],
      "context_rel": [
        {
          "kind": "shared-kernel",
          "with": "standards"
        }
      ],
      "references_count": 8,
      "codex_override_present": true
    },
    {
      "name": "codex-team",
      "description": "Coordinate multiple Codex agents.",
      "hexagonal_role": "supporting",
      "user_invocable": false,
      "consumes": [],
      "produces": [
        ".agents/swarm/results/*.json"
      ],
      "practices": [
        "team-topologies",
        "ai-assisted-dev"
      ],
      "context_rel": [],
      "references_count": 2,
      "codex_override_present": true
    },
    {
      "name": "compile",
      "description": "Compile .agents knowledge wiki.",
      "hexagonal_role": "supporting",
      "user_invocable": true,
      "consumes": [],
      "produces": [],
      "practices": [
        "wiki-knowledge-surface",
        "ddd-bounded-context"
      ],
      "context_rel": [],
      "references_count": 4,
      "codex_override_present": true
    },
    {
      "name": "complexity",
      "description": "Find focused refactor hotspots.",
      "hexagonal_role": "domain",
      "user_invocable": false,
      "consumes": [
        "doc",
        "standards"
      ],
      "produces": [
        "stdout"
      ],
      "practices": [
        "code-complete",
        "refactoring"
      ],
      "context_rel": [
        {
          "kind": "shared-kernel",
          "with": "standards"
        }
      ],
      "references_count": 0,
      "codex_override_present": true
    },
    {
      "name": "converter",
      "description": "Convert AgentOps skill formats.",
      "hexagonal_role": "generic",
      "user_invocable": false,
      "consumes": [],
      "produces": [
        "converted-skill"
      ],
      "practices": [
        "refactoring",
        "design-patterns"
      ],
      "context_rel": [],
      "references_count": 1,
      "codex_override_present": true
    },
    {
      "name": "council",
      "description": "Run multi-judge consensus.",
      "hexagonal_role": "domain",
      "user_invocable": false,
      "consumes": [
        "standards"
      ],
      "produces": [
        "result.json",
        "verdict.json"
      ],
      "practices": [
        "llm-eval-harness",
        "ai-assisted-dev",
        "design-by-contract"
      ],
      "context_rel": [
        {
          "kind": "shared-kernel",
          "with": "standards"
        }
      ],
      "references_count": 33,
      "codex_override_present": true
    },
    {
      "name": "crank",
      "description": "Execute epics through waves.",
      "hexagonal_role": "domain",
      "user_invocable": true,
      "consumes": [
        "beads",
        "implement",
        "post-mortem",
        "swarm",
        "vibe"
      ],
      "produces": [
        ".agents/swarm/results/*.json",
        "git-changes"
      ],
      "practices": [
        "continuous-delivery",
        "xp",
        "agile-manifesto"
      ],
      "context_rel": [
        {
          "kind": "shared-kernel",
          "with": "standards"
        }
      ],
      "references_count": 30,
      "codex_override_present": true
    },
    {
      "name": "curate",
      "description": "Mine transcripts, .agents, bd, and git for skill diffs, bd updates, or",
      "hexagonal_role": "supporting",
      "user_invocable": true,
      "consumes": [],
      "produces": [
        ".agents/research/*.md"
      ],
      "practices": [
        "wiki-knowledge-surface",
        "lean-startup"
      ],
      "context_rel": [],
      "references_count": 0,
      "codex_override_present": true
    },
    {
      "name": "deps",
      "description": "Audit dependency risks and updates.",
      "hexagonal_role": "driven-adapter",
      "user_invocable": false,
      "consumes": [],
      "produces": [
        "result.json"
      ],
      "practices": [
        "supply-chain-integrity",
        "continuous-delivery",
        "sre"
      ],
      "context_rel": [],
      "references_count": 1,
      "codex_override_present": true
    },
    {
      "name": "design",
      "description": "Validate product fit before discovery.",
      "hexagonal_role": "domain",
      "user_invocable": true,
      "consumes": [
        "standards"
      ],
      "produces": [
        "result.json"
      ],
      "practices": [
        "lean-startup",
        "ddd-bounded-context",
        "mythical-man-month"
      ],
      "context_rel": [
        {
          "kind": "shared-kernel",
          "with": "standards"
        }
      ],
      "references_count": 3,
      "codex_override_present": true
    },
    {
      "name": "discovery",
      "description": "Create dense execution packets.",
      "hexagonal_role": "domain",
      "user_invocable": true,
      "consumes": [
        "brainstorm",
        "design",
        "plan",
        "pre-mortem",
        "research",
        "shared"
      ],
      "produces": [
        ".agents/plans/*.md",
        "bd-issue",
        "execution-packet.json"
      ],
      "practices": [
        "adr",
        "lean-startup",
        "mythical-man-month"
      ],
      "context_rel": [
        {
          "kind": "shared-kernel",
          "with": "standards"
        }
      ],
      "references_count": 9,
      "codex_override_present": true
    },
    {
      "name": "doc",
      "description": "Generate and validate repo docs.",
      "hexagonal_role": "supporting",
      "user_invocable": false,
      "consumes": [],
      "produces": [
        "documentation"
      ],
      "practices": [
        "wiki-knowledge-surface",
        "code-complete",
        "pragmatic-programmer"
      ],
      "context_rel": [],
      "references_count": 6,
      "codex_override_present": true
    },
    {
      "name": "domain",
      "description": "Canonical vocabulary for human-AI software work.",
      "hexagonal_role": "domain",
      "user_invocable": false,
      "consumes": [],
      "produces": [
        "stdout"
      ],
      "practices": [
        "ddd-bounded-context",
        "wiki-knowledge-surface",
        "pragmatic-programmer"
      ],
      "context_rel": [],
      "references_count": 9,
      "codex_override_present": true
    },
    {
      "name": "dream",
      "description": "Run overnight compounding sessions.",
      "hexagonal_role": "supporting",
      "user_invocable": true,
      "consumes": [],
      "produces": [
        ".agents/research/*.md"
      ],
      "practices": [
        "lean-startup",
        "wiki-knowledge-surface",
        "sre"
      ],
      "context_rel": [],
      "references_count": 0,
      "codex_override_present": true
    },
    {
      "name": "evolve",
      "description": "Run autonomous improvement loops.",
      "hexagonal_role": "supporting",
      "user_invocable": true,
      "consumes": [],
      "produces": [],
      "practices": [
        "lean-startup",
        "dora-metrics",
        "agile-manifesto"
      ],
      "context_rel": [],
      "references_count": 23,
      "codex_override_present": true
    },
    {
      "name": "expert-council",
      "description": "Alias for /council --mode=debate — adversarial named-persona debate. Triggers: \"expert council\", \"dueling council\", \"council of <names>\". Kept one release.",
      "hexagonal_role": "domain",
      "user_invocable": true,
      "consumes": [],